{
  "$schema": "https://json-schema.org/draft/2020-12/schema",
  "$id": "https://igsl.dev/icsl/schemas/0.1-freeze/Receipt.schema.json",
  "title": "Receipt",
  "type": "object",
  "properties": {
    "kind": { "const": "Receipt" },
    "receipt_id": { "type": "string" },
    "protocol_version_id": { "type": "string" },
    "protocol_version_hash": {
      "$ref": "ICSLCommon.schema.json#/$defs/TaggedHash",
      "description": "REQUIRED part of the receipt content core: sha256 over the RFC 8785 (JCS) canonical bytes of the complete ProtocolVersion object named by protocol_version_id (the ProtocolVersion contains no hash of itself, so the preimage is non-self-referential). MUST equal the canonical hash of that ProtocolVersion (rule RECEIPT_PROTOCOL_VERSION_HASH_MATCH)."
    },
    "commitment_point_id": { "type": "string" },
    "governed_context_id": { "type": "string" },
    "outcome": { "type": "string" },
    "commitment_type": {
      "description": "Optional derived copy of the referenced CommitmentPoint's commitment_type: one of the eight core values, or the literal EXTENSION when the CommitmentPoint is extension-typed. If present it MUST match the referenced CommitmentPoint's type — EXTENSION matches EXTENSION (rule RECEIPT_COMMITMENT_TYPE_MATCH).",
      "oneOf": [
        { "$ref": "ICSLCommon.schema.json#/$defs/CoreCommitmentType" },
        { "const": "EXTENSION" }
      ]
    },
    "commitment_type_extension_id": {
      "type": "string",
      "description": "Optional; when commitment_type is EXTENSION this MAY carry the extension type id declared by the CommitmentPoint's commitment_type_extension."
    },
    "authority": { "type": "string" },
    "created_at": { "type": "string", "format": "date-time" },
    "effective_at": { "type": "string", "format": "date-time" },
    "receipt_hash": { "$ref": "ICSLCommon.schema.json#/$defs/TaggedHash" },
    "previous_hash": {
      "oneOf": [
        { "$ref": "ICSLCommon.schema.json#/$defs/TaggedHash" },
        { "type": "null" }
      ]
    },
    "acts_on": { "$ref": "ICSLCommon.schema.json#/$defs/ActsOn" },
    "deemed": { "type": "boolean" },
    "content": { "type": "object" },
    "content_hash": { "$ref": "ICSLCommon.schema.json#/$defs/TaggedHash" },
    "ai_assistance": {
      "$ref": "ICSLCommon.schema.json#/$defs/AiAssistance",
      "description": "Optional AI-assistance provenance for the accepted commitment."
    },
    "issuer": {
      "type": "string",
      "description": "Reserved for forward compatibility; unsigned in v0.1 (ADR-003)."
    },
    "signatures": {
      "type": "array",
      "description": "Reserved for forward compatibility; unsigned in v0.1 (ADR-003).",
      "items": {
        "type": "object",
        "properties": {
          "signer": { "type": "string" },
          "key_id": { "type": "string" },
          "alg": { "type": "string" },
          "value": { "type": "string" }
        },
        "required": ["signer", "key_id", "alg", "value"],
        "additionalProperties": false
      }
    }
  },
  "required": [
    "kind",
    "receipt_id",
    "protocol_version_id",
    "protocol_version_hash",
    "commitment_point_id",
    "governed_context_id",
    "outcome",
    "authority",
    "created_at",
    "receipt_hash",
    "previous_hash"
  ],
  "dependentRequired": {
    "content": ["content_hash"]
  },
  "additionalProperties": true
}
