{
  "kind": "Receipt",
  "receipt_id": "urn:opencommit:mutation-baseline:receipt:0001",
  "protocol_version_id": "urn:opencommit:mutation-baseline:pv:1.0.0",
  "protocol_version_hash": "sha256:3dea97d9cbad7a8db7d712e44e5514fc69d76771d3a5ded3d658f12d228627ee",
  "commitment_point_id": "cp-baseline-decide",
  "governed_context_id": "urn:opencommit:mutation-baseline:gc:case-0001",
  "outcome": "granted",
  "commitment_type": "DECIDE",
  "authority": "Baseline Permit Officer",
  "created_at": "2026-07-13T12:00:00Z",
  "effective_at": "2026-07-13T12:00:00Z",
  "receipt_hash": "sha256:3d65a7de4a9a72f7ef1f1d3daaeef3ce0d12a6124c93175d0795cd0a0e3f5390",
  "previous_hash": null
}
