[
  {
    "kind": "Receipt",
    "receipt_id": "rcpt-ec-000123-001",
    "protocol_version_id": "org.example-city.building.construction-permit@2.0.0",
    "protocol_version_hash": "sha256:41cc5f0a06255e9897499c34f4ac78449b590ea999c51973bc101a16f1512207",
    "commitment_point_id": "cp-01-intake",
    "commitment_type": "ATTEST",
    "governed_context_id": "gc-ec-2026-000123",
    "outcome": "registered",
    "authority": "Example City Building Authority, registry office",
    "created_at": "2026-03-02T09:15:00Z",
    "ai_assistance": {
      "involved": true,
      "role": "fact_extraction",
      "human_review": "attested"
    },
    "content": {
      "application_id": "APP-2026-000123",
      "filing_date": "2026-03-02",
      "parcel_id": "EC-04-0912",
      "fee_payment_recorded": true,
      "applicant_dossier": {
        "detached": true,
        "content_hash": "sha256:4389f7f571ac1f6c17f1f87910e0f14c143bad107020fad22be35b73f139d22c",
        "deployment_note": "Detached-payload storage and content-commitment controls are authority-specific deployment practices outside the ICSL v0.1 profile; this example asserts no interoperable salting, key-management, rectification, or erasure property."
      }
    },
    "previous_hash": null,
    "content_hash": "sha256:67522191e8d0fcc7dde135da280096fe8d378fe118e6679be3ceb6aed30b6263",
    "receipt_hash": "sha256:c797716b6c4ef51a9364e4b9f635ebc4cab26d29d6f9b6c778118026bdf4d825"
  },
  {
    "kind": "Receipt",
    "receipt_id": "rcpt-ec-000123-002",
    "protocol_version_id": "org.example-city.building.construction-permit@2.0.0",
    "protocol_version_hash": "sha256:41cc5f0a06255e9897499c34f4ac78449b590ea999c51973bc101a16f1512207",
    "commitment_point_id": "cp-03-completeness",
    "commitment_type": "DECIDE",
    "governed_context_id": "gc-ec-2026-000123",
    "outcome": "complete",
    "authority": "Case officer, Example City Building Authority (director delegation decree 2026/03)",
    "created_at": "2026-03-06T14:00:00Z",
    "ai_assistance": {
      "involved": false,
      "role": "none"
    },
    "content": {
      "checklist": "Building Act s.39(2)",
      "determination_date": "2026-03-06",
      "deemed_approval_anchor": "this receipt anchors the cp-08 clock (P90D)"
    },
    "previous_hash": "sha256:c797716b6c4ef51a9364e4b9f635ebc4cab26d29d6f9b6c778118026bdf4d825",
    "content_hash": "sha256:835aa5b21c57f1cc16ee823678067e7fe6b7b43720346f46e3e577481dba67ab",
    "receipt_hash": "sha256:0b6c493b49cc3487e29e4e207719426777aaa8313876fb8de9e0f559799a3cd5"
  },
  {
    "kind": "Receipt",
    "receipt_id": "rcpt-ec-000123-003",
    "protocol_version_id": "org.example-city.building.construction-permit@2.0.0",
    "protocol_version_hash": "sha256:41cc5f0a06255e9897499c34f4ac78449b590ea999c51973bc101a16f1512207",
    "commitment_point_id": "cp-06-technical-review",
    "commitment_type": "ATTEST",
    "governed_context_id": "gc-ec-2026-000123",
    "outcome": "conforming",
    "authority": "Chief municipal engineer, Example City Building Authority (technical review delegation decree 2026/07)",
    "created_at": "2026-04-14T10:30:00Z",
    "ai_assistance": {
      "involved": true,
      "role": "recommendation",
      "human_review": "attested"
    },
    "content": {
      "finding": "conforming",
      "zoning_plan_version": "2025-06",
      "objections_addressed": "1 registered objection addressed (the cp-05 receipt is elided from this abbreviated chain)",
      "certification": "automated conformity screening reviewed and certified by the reviewing engineer and the chief municipal engineer"
    },
    "previous_hash": "sha256:0b6c493b49cc3487e29e4e207719426777aaa8313876fb8de9e0f559799a3cd5",
    "content_hash": "sha256:5502c91e8f197364325f68ee6c51ba34ebce0cdaedb56bb41a6e003169ec41d6",
    "receipt_hash": "sha256:d1603b33ad225f813123bc0c5a868fc6734992fc9059a90520a63ec1ae676686"
  },
  {
    "kind": "Receipt",
    "receipt_id": "rcpt-ec-000123-004",
    "protocol_version_id": "org.example-city.building.construction-permit@2.0.0",
    "protocol_version_hash": "sha256:41cc5f0a06255e9897499c34f4ac78449b590ea999c51973bc101a16f1512207",
    "commitment_point_id": "cp-07-decision",
    "commitment_type": "DECIDE",
    "governed_context_id": "gc-ec-2026-000123",
    "outcome": "approved",
    "authority": "Deputy director, Example City Building Authority (decree 2026/02, structure below the 2000 m2 threshold)",
    "created_at": "2026-04-28T16:05:00Z",
    "effective_at": "2026-04-30T00:00:00Z",
    "ai_assistance": {
      "involved": true,
      "role": "drafting",
      "human_review": "attested"
    },
    "content": {
      "decision_number": "BD-2026-0458",
      "structure_class": "residential, below the 2000 m2 gross-floor-area threshold",
      "conditions": "none",
      "reasons_dossier": {
        "detached": true,
        "content_hash": "sha256:fa7a088220977d92b9496ddf5fdd4b5a04263476bc18cef3270e74a36f48174c",
        "deployment_note": "Detached-payload storage and content-commitment controls are authority-specific deployment practices outside the ICSL v0.1 profile; this example asserts no interoperable salting, key-management, rectification, or erasure property."
      }
    },
    "previous_hash": "sha256:d1603b33ad225f813123bc0c5a868fc6734992fc9059a90520a63ec1ae676686",
    "content_hash": "sha256:1b2d7dee14342ac4fa60a4c03cc06b76ada25b9103263a19459ae01d3d22bbf5",
    "receipt_hash": "sha256:260742739ba3424457b64bd6d78a6b1928d3c6428366c3aa9e7926920ac41f6d"
  },
  {
    "kind": "Receipt",
    "receipt_id": "rcpt-ec-000123-005",
    "protocol_version_id": "org.example-city.building.construction-permit@2.0.0",
    "protocol_version_hash": "sha256:41cc5f0a06255e9897499c34f4ac78449b590ea999c51973bc101a16f1512207",
    "commitment_point_id": "cp-09-appeal-admissibility",
    "commitment_type": "DECIDE",
    "governed_context_id": "gc-ec-2026-000123",
    "outcome": "admissible_effect_suspended",
    "authority": "Municipal Appeals Board, presiding member",
    "created_at": "2026-05-12T11:20:00Z",
    "acts_on": {
      "target_receipt_id": "rcpt-ec-000123-004",
      "effect": "suspend"
    },
    "ai_assistance": {
      "involved": false,
      "role": "none"
    },
    "content": {
      "appeal_number": "AB-2026-017",
      "standing_basis": "registered objector (the cp-05 receipt is elided from this abbreviated chain)",
      "admissibility": "standing, timeliness, and form satisfied (Building Act s.47(1))",
      "effect_note": "admission suspends decision BD-2026-0458 under Building Act s.47(2) until disposition (cp-10-appeal-disposition)"
    },
    "previous_hash": "sha256:260742739ba3424457b64bd6d78a6b1928d3c6428366c3aa9e7926920ac41f6d",
    "content_hash": "sha256:11c988d839443ff967dda1de8951705b1c9f6dc80cf5bf63fb96671d31ce3cf0",
    "receipt_hash": "sha256:564d2675978b073fc21d460854a6c316615cbe95bf0ca534ad72d2c1816f5657"
  },
  {
    "kind": "Receipt",
    "receipt_id": "rcpt-ec-000123-006",
    "protocol_version_id": "org.example-city.building.construction-permit@2.0.0",
    "protocol_version_hash": "sha256:41cc5f0a06255e9897499c34f4ac78449b590ea999c51973bc101a16f1512207",
    "commitment_point_id": "cp-10-appeal-disposition",
    "commitment_type": "APPEAL",
    "governed_context_id": "gc-ec-2026-000123",
    "outcome": "appeal_dismissed_effect_revived",
    "authority": "Municipal Appeals Board",
    "created_at": "2026-06-16T15:40:00Z",
    "acts_on": {
      "target_receipt_id": "rcpt-ec-000123-004",
      "effect": "revive"
    },
    "ai_assistance": {
      "involved": false,
      "role": "none"
    },
    "content": {
      "appeal_number": "AB-2026-017",
      "disposition": "dismissed on the merits; the appealed decision is revived (Building Act s.48); admission per receipt rcpt-ec-000123-005 (cp-09-appeal-admissibility, outcome admissible_effect_suspended)",
      "further_recourse": "Administrative Court within P30D (Building Act s.48(4))",
      "reasons_dossier": {
        "detached": true,
        "content_hash": "sha256:c7c9d38e6f86d1cb7b043d17802bab55a423365e26cc644462b129ac8e628c1b",
        "deployment_note": "Detached-payload storage and content-commitment controls are authority-specific deployment practices outside the ICSL v0.1 profile; this example asserts no interoperable salting, key-management, rectification, or erasure property."
      }
    },
    "previous_hash": "sha256:564d2675978b073fc21d460854a6c316615cbe95bf0ca534ad72d2c1816f5657",
    "content_hash": "sha256:ee05d17d12e51b6c7fba55aa3585129773db549655b720c75e0c45f39c3cb43b",
    "receipt_hash": "sha256:0903a9b6701f95c83128555e47afa31c93e337b649a7a66d304c768816a1de5b"
  }
]
